avaer-1094|completely separate thread and so by accident we were able to get 144fps|completely separate thread and so by accident we were able to get one hundred forty-fourfps
avaer-1481|don't want to have to make avatars I don't want to have to do the voice stuff|don't want to have to make avatars i don't want to have to do the voice stuff
avaer-1617|we have a service worker that's running inside of the page and this HT this web|we have a service worker that's running inside of the page and this ht this web
avaer-1105|dot-com or org I think it is as well as loading hubs dot mozilla.org as well as|dot-com or org i think it is as well as loading hubs dot mozilla.org as well as
avaer-803|got another question from Spidey he says sounds like this relies on some sort of|got another question from spidey he says sounds like this relies on some sort of
avaer-735|go through the oculus store but nobody's using sideload now right so that solves|go through the oculus store but nobody's using sideload now right so that solves
avaer-1748|magnitude it's less than twice as slow in the browser so there is still some|magnitude it's less than twice as slow in the browser so there is still some
avaer-628|execute web and you can have reality tabs in any of your existing projects so|execute web and you can have reality tabs in any of your existing projects so
avaer-1695|VR and AR and there's a lot that we can do with that and exploring what does it|vr and ar and there's a lot that we can do with that and exploring what does it
avaer-1255|to just you know just a Mozilla browser or was everybody|to just you know just a mozilla browser or was everybody
avaer-1601|around CSS HTML react all that goodness and so what I was able to do here is I|around css html react all that goodness and so what i was able to do here is i
avaer-1193|live view that bridges the gap between VR and AR and there's a lot that we can|live view that bridges the gap between vr and ar and there's a lot that we can
avaer-1818|you even design something like this as to the question of will browsers disable|you even design something like this as to the question of will browsers disable
avaer-96|a huge mature industry just designed around CSS HTML react all that goodness|a huge mature industry just designed around css html react all that goodness
avaer-1804|like to participate more in the open XR spec as well I was actually on the WebEx|like to participate more in the open xr spec as well i was actually on the webex
avaer-786|team's talk in terms of spec you know there are different core groups but as|team's talk in terms of spec you know there are different core groups but as
avaer-1973|want the depth of the scenes to be a certain that is an excellent very good|want the depth of the scenes to be a certain that is an excellent very good
avaer-950|standardized on all this is available on all the headsets right now and in fact|standardized on all this is available on all the headsets right now and in fact
avaer-1284|this there's a lot of cross-pollination there but yeah I look forward to reading|this there's a lot of cross-pollination there but yeah i look forward to reading
avaer-553|matter of copy pasting and changing a few lines you can move literal browsers|matter of copy pasting and changing a few lines you can move literal browsers
avaer-1477|we've tested it up to a hundred just at that point the amount of draw calls|we've tested it up to a hundred just at that point the amount of draw calls
avaer-445|soon they're already running and if you deep integration into the guts of the|soon they're already running and if you deep integration into the guts of the
avaer-506|okay it initially started by adding support for web XR and magic leap this|okay it initially started by adding support for web xr and magic leap this
avaer-1448|soon they're already running and if you deep integration into the guts of the|soon they're already running and if you deep integration into the guts of the
avaer-1715|roadmap but there's still some areas where we like to encourage people to|roadmap but there's still some areas where we like to encourage people to
avaer-1679|where you can open up sites and you can program essentially the web XR aspect of|where you can open up sites and you can program essentially the web xr aspect of
avaer-1128|download free thing you will be able to just access a site or even do an import|download free thing you will be able to just access a site or even do an import
avaer-656|this and we have somewhat of a stable virtual world virtual meta world is we|this and we have somewhat of a stable virtual world virtual meta world is we
avaer-1978|here you actually have infinite context we've tested it up to a hundred just at|here you actually have infinite context we've tested it up to a hundred just at
avaer-812|though is like do you want sites to be able to read each other's frame buffer|though is like do you want sites to be able to read each other's frame buffer
avaer-1331|behind it basically each one of these sites is completely isolated from every|behind it basically each one of these sites is completely isolated from every
avaer-69|um you can actually do a full 3d blend that's perfectly framed accurate despite|um you can actually do a full threed blend that's perfectly framed accurate despite
avaer-398|doesn't require that trust doesn't because the iframe trick requires there|doesn't require that trust doesn't because the iframe trick requires there
avaer-548|browser in magiclip it runs inside of a browser on the oculus quest and you|browser in magiclip it runs inside of a browser on the oculus quest and you
avaer-745|magnitude it's less than twice as slow in the browser so there is still some|magnitude it's less than twice as slow in the browser so there is still some
avaer-38|so the iteration of execute that you're looking at here is the latest version|so the iteration of execute that you're looking at here is the latest version
avaer-478|don't want to have to make avatars I don't want to have to do the voice stuff|don't want to have to make avatars i don't want to have to do the voice stuff
avaer-1380|sometimes go viral and the things that I ask them like you don't go anywhere so I|sometimes go viral and the things that i ask them like you don't go anywhere so i
avaer-461|doing okay the reason why I brought this up is can those sub scenes have a like a|doing okay the reason why i brought this up is can those sub scenes have a like a
avaer-382|and one of the entries can be produced in a video and so that's kind of what|and one of the entries can be produced in a video and so that's kind of what
avaer-1959|yep okay so from what I understand with unreal subsystem is that you have|yep okay so from what i understand with unreal subsystem is that you have
avaer-352|and yeah but there is the open question of like what can we do to prevent one of|and yeah but there is the open question of like what can we do to prevent one of
avaer-1210|execute regular I'm sorry imagine the desktop versions you know like why would|execute regular i'm sorry imagine the desktop versions you know like why would
avaer-801|like to participate more in the open XR spec as well I was actually on the WebEx|like to participate more in the open xr spec as well i was actually on the webex
avaer-308|layer is here is doing the right thing so when you access this site you will|layer is here is doing the right thing so when you access this site you will
avaer-1030|website so here we actually see gltf model as well as crypto voxels as well|website so here we actually see gltf model as well as crypto voxels as well
avaer-601|technology of virtual GL and reality tabs another thing that we needed to|technology of virtual gl and reality tabs another thing that we needed to
avaer-1611|sharing so you might think okay well how is this working at all in chrome like|sharing so you might think okay well how is this working at all in chrome like
avaer-535|I don't work with the hub's devs and I don't know anything about HTML really|i don't work with the hub's devs and i don't know anything about html really
avaer-1017|compatible with everything runs on every device and it has huge backing by almost|compatible with everything runs on every device and it has huge backing by almost
avaer-181|api's you can use voice recognition in order to create actual AIS in an actual|api's you can use voice recognition in order to create actual ais in an actual
avaer-1401|doesn't require that trust doesn't because the iframe trick requires there|doesn't require that trust doesn't because the iframe trick requires there
avaer-1587|enabled a feature that allowed us to draw asynchronously HTML into a texture|enabled a feature that allowed us to draw asynchronously html into a texture
avaer-1873|have built this realms API and it allows you to scope objects and what they get|have built this realms api and it allows you to scope objects and what they get
avaer-83|draw asynchronously HTML into a texture and so why would you want something like|draw asynchronously html into a texture and so why would you want something like
avaer-1882|ask them like you don't go anywhere so I have no idea but um I was going to put|ask them like you don't go anywhere so i have no idea but um i was going to put
avaer-244|in the browser so there is still some cases that you would probably need to go|in the browser so there is still some cases that you would probably need to go
avaer-1428|button on your headset in order to effect some sort of input so anywhere on|button on your headset in order to effect some sort of input so anywhere on
avaer-1434|example when you open the iframe everything else would have to disappear|example when you open the iframe everything else would have to disappear
avaer-1910|on top of a GL context at the HTML layer this is not this is not the|on top of a gl context at the html layer this is not this is not the
avaer-908|implementation that we're using here because it's a context I know right now|implementation that we're using here because it's a context i know right now
avaer-1786|there but yeah I look forward to reading the open XR spec I still haven't read it|there but yeah i look forward to reading the open xr spec i still haven't read it
avaer-35|reality tabs and web XR to compose all these different worlds together and this|reality tabs and web xr to compose all these different worlds together and this
avaer-426|the iframe and then the parent doesn't get updates after that would it that|the iframe and then the parent doesn't get updates after that would it that
avaer-235|comes down to like payments as well but yeah basically the reason that I started|comes down to like payments as well but yeah basically the reason that i started
avaer-190|live view that bridges the gap between VR and AR and there's a lot that we can|live view that bridges the gap between vr and ar and there's a lot that we can
avaer-528|open multiple sites into a single website so here we actually see gltf|open multiple sites into a single website so here we actually see gltf
avaer-1342|see this is essentially just using regular ap is that have existed for a|see this is essentially just using regular ap is that have existed for a
avaer-1960|multiple subs scenes at a lower level and you have one master scene yeah|multiple subs scenes at a lower level and you have one master scene yeah
avaer-596|I think hTML is probably the best way to draw you eyes I think a lot of people|i think html is probably the best way to draw you eyes i think a lot of people
avaer-1234|and even on something like an app store like on the akio store you basically|and even on something like an app store like on the akio store you basically
avaer-1435|that I can imagine that I can imagine being secured but yeah there's a whole|that i can imagine that i can imagine being secured but yeah there's a whole
avaer-435|packaging up these into binary builds so electron NWA and wjs or something else|packaging up these into binary builds so electron nwa and wjs or something else
avaer-1138|there is actually a second user in this world it's not so easy to see it's|there is actually a second user in this world it's not so easy to see it's
avaer-1464|doing okay the reason why I brought this up is can those sub scenes have a like a|doing okay the reason why i brought this up is can those sub scenes have a like a
avaer-1460|can't speak to unreal I'm not an unreal user but it sounds like that yes okay|can't speak to unreal i'm not an unreal user but it sounds like that yes okay
avaer-1631|execute web and you can have reality tabs in any of your existing projects so|execute web and you can have reality tabs in any of your existing projects so
avaer-625|kind of made it down the pipeline to Chrome and yeah now we can basically|kind of made it down the pipeline to chrome and yeah now we can basically
avaer-975|here you actually have infinite context we've tested it up to a hundred just at|here you actually have infinite context we've tested it up to a hundred just at
avaer-977|and you just basically take a frame rate hit but yeah there is really no|and you just basically take a frame rate hit but yeah there is really no
avaer-519|like what can we do once we control a browser that we've written natively a|like what can we do once we control a browser that we've written natively a
avaer-1872|realms so yep there's a company that's that's here in the blockchain space that|realms so yep there's a company that's that's here in the blockchain space that
avaer-252|to just you know just a Mozilla browser or was everybody|to just you know just a mozilla browser or was everybody
avaer-1000|it person if you guys haven't seen koalas other talk on basically opening|it person if you guys haven't seen koalas other talk on basically opening
avaer-1739|like one aspect of that but then it comes down to like payments as well but|like one aspect of that but then it comes down to like payments as well but
avaer-454|technology so one last question yep okay so from what I understand with|technology so one last question yep okay so from what i understand with
avaer-1788|cool thank you so much I had a question how much do the open XR and WebEx our|cool thank you so much i had a question how much do the open xr and webex our
avaer-1599|I think hTML is probably the best way to draw you eyes I think a lot of people|i think html is probably the best way to draw you eyes i think a lot of people
avaer-536|but you can use technologies like reality tabs and web XR to compose all|but you can use technologies like reality tabs and web xr to compose all
avaer-606|works is you are not allowed to load multiple different origins into a single|works is you are not allowed to load multiple different origins into a single
avaer-1095|drawing of HTML textures into 3d worlds finally and so you can see some of that|drawing of html textures into threed worlds finally and so you can see some of that
avaer-1479|hit but yeah there is really no performance problems at the moment cool|hit but yeah there is really no performance problems at the moment cool
avaer-584|enabled a feature that allowed us to draw asynchronously HTML into a texture|enabled a feature that allowed us to draw asynchronously html into a texture
avaer-84|that well in VR you want to hit your target frame rate on the oculus quest at|that well in vr you want to hit your target frame rate on the oculus quest at
avaer-1569|graphical languages using Z buffers and stuff you can inject a matrix into one|graphical languages using z buffers and stuff you can inject a matrix into one
avaer-1171|of payments to happen and a simple API for people to use for developers to use|of payments to happen and a simple api for people to use for developers to use
avaer-1808|to dissonant future that is a good question the one thing that two things|to dissonant future that is a good question the one thing that two things
avaer-493|are using proxy server or something like that or not WebRTC we basically have a|are using proxy server or something like that or not webrtc we basically have a
avaer-1061|invented something called virtual GL it's basically taking the concept of a|invented something called virtual gl it's basically taking the concept of a
avaer-1206|future for that when you know EXO could web getting all these they will both be|future for that when you know exo could web getting all these they will both be
avaer-101|you might notice that we are actually literally loading our HTTP crypto voxels|you might notice that we are actually literally loading our http crypto voxels
avaer-997|RTC how many people can handle I'm going to give the answer that hugs ain't what|rtc how many people can handle i'm going to give the answer that hugs ain't what
avaer-1064|and what I did is I took the concept of one of these GL contexts and I|and what i did is i took the concept of one of these gl contexts and i
avaer-631|staged and secure way so we were thinking that this early next week we|staged and secure way so we were thinking that this early next week we
avaer-1318|think they can mostly because as far as the site is concerned this is just a|think they can mostly because as far as the site is concerned this is just a
avaer-1186|we want to also explore the concept of merging one of these meta verses with|we want to also explore the concept of merging one of these meta verses with
avaer-188|your own bedroom be projected into one of these virtual worlds using something|your own bedroom be projected into one of these virtual worlds using something
avaer-1911|implementation that we're using here because it's a context I know right now|implementation that we're using here because it's a context i know right now
avaer-1886|happening right now with crypto voxels and one of the entries can be produced|happening right now with crypto voxels and one of the entries can be produced
avaer-593|accident we were able to get 144fps drawing of HTML textures into 3d worlds|accident we were able to get one hundred forty-fourfps drawing of html textures into threed worlds
avaer-1940|electron NWA and wjs or something else are we talking about executing native or|electron nwa and wjs or something else are we talking about executing native or
avaer-927|effect some sort of input so anywhere on the iframe and then the parent doesn't|effect some sort of input so anywhere on the iframe and then the parent doesn't
avaer-1303|spec as well I was actually on the WebEx our group briefly but yeah I should|spec as well i was actually on the webex our group briefly but yeah i should
avaer-310|it is secure in that regard the question though is like do you want sites to be|it is secure in that regard the question though is like do you want sites to be
avaer-1438|packaging up these into binary builds so electron NWA and wjs or something else|packaging up these into binary builds so electron nwa and wjs or something else
avaer-1889|anything but to do with the the CSS 3d that's what makes that that separate|anything but to do with the the css threed that's what makes that that separate
avaer-342|have for a security though is that it is a pretty well defined to me a set of|have for a security though is that it is a pretty well defined to me a set of
avaer-1343|while so it would be really tough to quote unquote close this hole while also|while so it would be really tough to quote unquote close this hole while also
avaer-1832|something that has mountains of security behind it basically each one of these|something that has mountains of security behind it basically each one of these
avaer-431|example when you open the iframe everything else would have to disappear|example when you open the iframe everything else would have to disappear
avaer-1659|this and we have somewhat of a stable virtual world virtual meta world is we|this and we have somewhat of a stable virtual world virtual meta world is we
avaer-1067|just the regular machine machinery of graphical languages using Z buffers and|just the regular machine machinery of graphical languages using z buffers and
avaer-450|much any site will be able to use this just by importing execute web and just|much any site will be able to use this just by importing execute web and just
avaer-203|future for that when you know EXO could web getting all these they will both be|future for that when you know exo could web getting all these they will both be
avaer-1288|there are different core groups but as far as the technology goes like for|there are different core groups but as far as the technology goes like for
avaer-778|X or spec and some idea of like user actions as WebEx or have something|x or spec and some idea of like user actions as webex or have something
avaer-462|similar like a scene similar to the master scene that is basically what|similar like a scene similar to the master scene that is basically what
avaer-71|thing that we invented here and this was only recently possible I think a month|thing that we invented here and this was only recently possible i think a month
avaer-421|it's just very hard to maintain some level of rendering in a WebEx or world|it's just very hard to maintain some level of rendering in a webex or world
avaer-1246|magnitude or sorry not an order of magnitude it's less than twice as slow|magnitude or sorry not an order of magnitude it's less than twice as slow
avaer-39|which actually runs in Chrome um execute started as a native project but recently|which actually runs in chrome um execute started as a native project but recently
avaer-599|can literally just write my HTML page and make a menu out of it|can literally just write my html page and make a menu out of it
avaer-957|multiple subs scenes at a lower level and you have one master scene yeah|multiple subs scenes at a lower level and you have one master scene yeah
avaer-469|certain that is an excellent very good question um actually the way that we|certain that is an excellent very good question um actually the way that we
avaer-829|something that has mountains of security behind it basically each one of these|something that has mountains of security behind it basically each one of these
avaer-1639|want to release is you might notice that there is actually a second user in this|want to release is you might notice that there is actually a second user in this
avaer-970|want the depth of the scenes to be a certain that is an excellent very good|want the depth of the scenes to be a certain that is an excellent very good
avaer-651|n3 and we'll probably post the link as well in here if you guys want to be one|nthree and we'll probably post the link as well in here if you guys want to be one
avaer-207|execute regular I'm sorry imagine the desktop versions you know like why would|execute regular i'm sorry imagine the desktop versions you know like why would
avaer-843|general GL on the web the answer that I have for a security though is that it is|general gl on the web the answer that i have for a security though is that it is
avaer-1076|attacks were this class of security bugs that on some brilliant researchers I|attacks were this class of security bugs that on some brilliant researchers i
avaer-1711|sharing code between execute web and execute regular I'm sorry imagine the|sharing code between execute web and execute regular i'm sorry imagine the
avaer-1789|team's talk in terms of spec you know there are different core groups but as|team's talk in terms of spec you know there are different core groups but as
avaer-529|model as well as crypto voxels as well as Mozilla hubs as well as a UI that I|model as well as crypto voxels as well as mozilla hubs as well as a ui that i
avaer-1133|thinking that this early next week we will release exo-k at web which is just|thinking that this early next week we will release exo-k at web which is just
avaer-633|reality tabs of any two sites or infinitely many sites and we'll be|reality tabs of any two sites or infinitely many sites and we'll be
avaer-27|website so here we actually see gltf model as well as crypto voxels as well|website so here we actually see gltf model as well as crypto voxels as well
avaer-284|how much do the open XR and WebEx our team's talk in terms of spec you know|how much do the open xr and webex our team's talk in terms of spec you know
avaer-1697|map to the virtual world how do we make sure that everything is secure with|map to the virtual world how do we make sure that everything is secure with
avaer-178|let's say I wanted to have a butler for my crypto Vox this world that could be|let's say i wanted to have a butler for my crypto vox this world that could be
avaer-1604|technology of virtual GL and reality tabs another thing that we needed to|technology of virtual gl and reality tabs another thing that we needed to
avaer-785|cool thank you so much I had a question how much do the open XR and WebEx our|cool thank you so much i had a question how much do the open xr and webex our
avaer-566|graphical languages using Z buffers and stuff you can inject a matrix into one|graphical languages using z buffers and stuff you can inject a matrix into one
avaer-348|here basically has ultimate say over the rendering in the end so if that top|here basically has ultimate say over the rendering in the end so if that top
avaer-492|yeah so I'm the mole topic of multiplayer how are you handling it like|yeah so i'm the mole topic of multiplayer how are you handling it like
avaer-1951|particular headsets or I can't speak to what any particular company is doing|particular headsets or i can't speak to what any particular company is doing
avaer-1312|still get an HTTPS lock that says you are visiting whatever exo-k web org so|still get an https lock that says you are visiting whatever exo-k web org so
